{
  "version": "1.0",
  "metadata": {
    "atlasId": "france",
    "atlasName": "France",
    "exportDate": "2025-10-13T09:01:03.526Z",
    "createdWith": "Atlas composer v1.0"
  },
  "pattern": "single-focus",
  "referenceScale": 2700,
  "territories": [
    {
      "code": "FR-MET",
      "name": "France Métropolitaine",
      "role": "primary",
      "projectionId": "conic-conformal",
      "projectionFamily": "CONIC",
      "parameters": {
        "center": [
          0,
          0
        ],
        "rotate": [
          -3,
          -46.2,
          0
        ],
        "scale": 2700,
        "baseScale": 2700,
        "scaleMultiplier": 1,
        "parallels": [
          -2,
          2
        ]
      },
      "layout": {
        "translateOffset": [
          0,
          0
        ],
        "clipExtent": [
          [
            -0.0996,
            -0.0908
          ],
          [
            0.0967,
            0.0864
          ]
        ]
      },
      "bounds": [
        [
          -5,
          41
        ],
        [
          10,
          51
        ]
      ]
    },
    {
      "code": "FR-GP",
      "name": "Guadeloupe",
      "role": "secondary",
      "projectionId": "mercator",
      "projectionFamily": "CYLINDRICAL",
      "parameters": {
        "center": [
          -61.46,
          16.14
        ],
        "rotate": [
          0,
          0,
          0
        ],
        "scale": 5292,
        "baseScale": 3780,
        "scaleMultiplier": 1.4,
        "parallels": [
          0,
          0
        ]
      },
      "layout": {
        "translateOffset": [
          -324,
          -38
        ],
        "clipExtent": [
          [
            null,
            null
          ],
          [
            null,
            null
          ]
        ]
      },
      "bounds": [
        [
          -61.81,
          15.83
        ],
        [
          -61,
          16.52
        ]
      ]
    },
    {
      "code": "FR-MQ",
      "name": "Martinique",
      "role": "secondary",
      "projectionId": "mercator",
      "projectionFamily": "CYLINDRICAL",
      "parameters": {
        "center": [
          -61.03,
          14.67
        ],
        "rotate": [
          0,
          0,
          0
        ],
        "scale": 6912,
        "baseScale": 4320,
        "scaleMultiplier": 1.6,
        "parallels": [
          0,
          0
        ]
      },
      "layout": {
        "translateOffset": [
          -324,
          35
        ],
        "clipExtent": [
          [
            null,
            null
          ],
          [
            null,
            null
          ]
        ]
      },
      "bounds": [
        [
          -61.23,
          14.39
        ],
        [
          -60.81,
          14.88
        ]
      ]
    },
    {
      "code": "FR-GF",
      "name": "Guyane",
      "role": "secondary",
      "projectionId": "mercator",
      "projectionFamily": "CYLINDRICAL",
      "parameters": {
        "center": [
          -53.2,
          3.9
        ],
        "rotate": [
          0,
          0,
          0
        ],
        "scale": 2754,
        "baseScale": 1620,
        "scaleMultiplier": 1.7,
        "parallels": [
          0,
          0
        ]
      },
      "layout": {
        "translateOffset": [
          -324,
          160
        ],
        "clipExtent": [
          [
            null,
            null
          ],
          [
            null,
            null
          ]
        ]
      },
      "bounds": [
        [
          -54.6,
          2.1
        ],
        [
          -51.6,
          5.8
        ]
      ]
    },
    {
      "code": "FR-RE",
      "name": "La Réunion",
      "role": "secondary",
      "projectionId": "mercator",
      "projectionFamily": "CYLINDRICAL",
      "parameters": {
        "center": [
          55.52,
          -21.13
        ],
        "rotate": [
          0,
          0,
          0
        ],
        "scale": 3888,
        "baseScale": 3240,
        "scaleMultiplier": 1.2,
        "parallels": [
          0,
          0
        ]
      },
      "layout": {
        "translateOffset": [
          313,
          -96
        ],
        "clipExtent": [
          [
            null,
            null
          ],
          [
            null,
            null
          ]
        ]
      },
      "bounds": [
        [
          55.22,
          -21.39
        ],
        [
          55.84,
          -20.87
        ]
      ]
    },
    {
      "code": "FR-YT",
      "name": "Mayotte",
      "role": "secondary",
      "projectionId": "mercator",
      "projectionFamily": "CYLINDRICAL",
      "parameters": {
        "center": [
          45.16,
          -12.8
        ],
        "rotate": [
          0,
          0,
          0
        ],
        "scale": 6912,
        "baseScale": 4320,
        "scaleMultiplier": 1.6,
        "parallels": [
          0,
          0
        ]
      },
      "layout": {
        "translateOffset": [
          316,
          -173
        ],
        "clipExtent": [
          [
            null,
            null
          ],
          [
            null,
            null
          ]
        ]
      },
      "bounds": [
        [
          44.98,
          -13
        ],
        [
          45.3,
          -12.64
        ]
      ]
    },
    {
      "code": "FR-MF",
      "name": "Saint-Martin",
      "role": "secondary",
      "projectionId": "mercator",
      "projectionFamily": "CYLINDRICAL",
      "parameters": {
        "center": [
          -63.082,
          18.067
        ],
        "rotate": [
          0,
          0,
          0
        ],
        "scale": 67500,
        "baseScale": 13500,
        "scaleMultiplier": 5,
        "parallels": [
          0,
          0
        ]
      },
      "layout": {
        "translateOffset": [
          -324,
          -119
        ],
        "clipExtent": [
          [
            null,
            null
          ],
          [
            null,
            null
          ]
        ]
      },
      "bounds": [
        [
          -63.15,
          18.04
        ],
        [
          -63,
          18.13
        ]
      ]
    },
    {
      "code": "FR-PM",
      "name": "Saint-Pierre-et-Miquelon",
      "role": "secondary",
      "projectionId": "mercator",
      "projectionFamily": "CYLINDRICAL",
      "parameters": {
        "center": [
          -56.23,
          46.93
        ],
        "rotate": [
          0,
          0,
          0
        ],
        "scale": 4563,
        "baseScale": 3510,
        "scaleMultiplier": 1.3,
        "parallels": [
          0,
          0
        ]
      },
      "layout": {
        "translateOffset": [
          -324,
          -176
        ],
        "clipExtent": [
          [
            null,
            null
          ],
          [
            null,
            null
          ]
        ]
      },
      "bounds": [
        [
          -56.42,
          46.75
        ],
        [
          -56.13,
          47.15
        ]
      ]
    },
    {
      "code": "FR-WF",
      "name": "Wallis-et-Futuna",
      "role": "secondary",
      "projectionId": "mercator",
      "projectionFamily": "CYLINDRICAL",
      "parameters": {
        "center": [
          -178.1,
          -14.3
        ],
        "rotate": [
          0,
          0,
          0
        ],
        "scale": 19683,
        "baseScale": 7290,
        "scaleMultiplier": 2.7,
        "parallels": [
          0,
          0
        ]
      },
      "layout": {
        "translateOffset": [
          313,
          59
        ],
        "clipExtent": [
          [
            null,
            null
          ],
          [
            null,
            null
          ]
        ]
      },
      "bounds": [
        [
          -178.2,
          -14.4
        ],
        [
          -176.1,
          -13.2
        ]
      ]
    },
    {
      "code": "FR-PF",
      "name": "Polynésie française",
      "role": "secondary",
      "projectionId": "mercator",
      "projectionFamily": "CYLINDRICAL",
      "parameters": {
        "center": [
          -150.55,
          -17.11
        ],
        "rotate": [
          0,
          0,
          0
        ],
        "scale": 675,
        "baseScale": 1350,
        "scaleMultiplier": 0.5,
        "parallels": [
          0,
          0
        ]
      },
      "layout": {
        "translateOffset": [
          311,
          203
        ],
        "clipExtent": [
          [
            null,
            null
          ],
          [
            null,
            null
          ]
        ]
      },
      "bounds": [
        [
          -154,
          -28
        ],
        [
          -134,
          -7
        ]
      ]
    },
    {
      "code": "FR-PF-2",
      "name": "Polynésie française (îles éloignées)",
      "role": "secondary",
      "projectionId": "mercator",
      "projectionFamily": "CYLINDRICAL",
      "parameters": {
        "center": [
          -150.55,
          -17.11
        ],
        "rotate": [
          0,
          0,
          0
        ],
        "scale": 9.72,
        "baseScale": 162,
        "scaleMultiplier": 0.06,
        "parallels": [
          0,
          0
        ]
      },
      "layout": {
        "translateOffset": [
          297,
          122
        ],
        "clipExtent": [
          [
            null,
            null
          ],
          [
            null,
            null
          ]
        ]
      },
      "bounds": [
        [
          -154,
          -28
        ],
        [
          -134,
          -7
        ]
      ]
    },
    {
      "code": "FR-NC",
      "name": "Nouvelle-Calédonie",
      "role": "secondary",
      "projectionId": "mercator",
      "projectionFamily": "CYLINDRICAL",
      "parameters": {
        "center": [
          165.8,
          -21.07
        ],
        "rotate": [
          0,
          0,
          0